{
  "version": 2,
  "id": "raft-campaign/etcdraft-ready-must-sync-v1",
  "protocol": "etcd-raft-v3.6",
  "pss_id": "raft-family-pss-v1",
  "runtime_profile": "etcdraft-ready-must-sync-v1",
  "nodes": ["n1", "n2", "n3"],
  "required_capabilities": [
    "application-apply",
    "conditional-ready-sync",
    "explicit-campaign",
    "message-release-control",
    "read-index-input",
    "ready-must-sync-observation",
    "visible-write-durable-sync"
  ],
  "coverage": {
    "weights": {"boundary": 0.5, "property": 0.5},
    "obligations": [
      {
        "id": "boundary.election-rounds.1",
        "category": "boundary",
        "description": "Reach one explicit Raft election before the recovery boundary.",
        "evidence": {
          "reach": [{"event_kind": "campaign", "observation_label": "transition:follower->candidate"}],
          "observe": [{"event_kind": "campaign", "observation_label": "transition:follower->candidate"}]
        },
        "monitors": ["agreement"],
        "requires": ["explicit-campaign"],
        "risk": "high",
        "status": "supported"
      },
      {
        "id": "boundary.proposals.1",
        "category": "boundary",
        "description": "Commit one proposal before the restart boundary.",
        "evidence": {
          "reach": [{"event_kind": "propose"}],
          "observe": [{"observation_kind": "commit"}]
        },
        "monitors": ["agreement"],
        "requires": ["application-apply", "message-release-control"],
        "risk": "high",
        "status": "supported"
      },
      {
        "id": "property.ready-must-sync-empty-hardstate",
        "category": "property",
        "description": "Observe the native Ready.MustSync decision for message-only work with an unchanged HardState.",
        "evidence": {
          "reach": [{"event_kind": "query"}],
          "observe": [{
            "observation_kind": "ready",
            "observation_label": "ready:must-sync",
            "observation_evidence": {"entries": "0", "hard_state_empty": "true"}
          }],
          "orderings": [
            {
              "before": {"event_kind": "query"},
              "after": {"event_kind": "acknowledge", "observation_label": "ready:must-sync"},
              "same_target": true
            }
          ]
        },
        "monitors": ["ready-must-sync"],
        "requires": [
          "conditional-ready-sync",
          "read-index-input",
          "ready-must-sync-observation"
        ],
        "risk": "high",
        "status": "supported"
      }
    ]
  },
  "threshold": {"score": 80, "min_category": 0.6}
}
